{
  "id": "g1-predicting-001",
  "grade": 1,
  "title": "The Dark Cloud",
  "source": "original",
  "text": "Ben and his mom walk to the park. The sky turns gray, and a big dark cloud rolls in. The wind starts to blow the leaves around. Ben feels a cold drop land on his hand. His mom opens her umbrella just in time. Fat raindrops begin to fall all over the park. Ben and his mom hurry home before the storm gets worse.",
  "skills": [
    "predicting_outcomes",
    "literal_comprehension"
  ],
  "primary_skill": "predicting_outcomes",
  "comprehension_hint_topics": [
    "what the dark cloud is a clue about",
    "why mom opens her umbrella"
  ],
  "words": [
    "Ben",
    "and",
    "his",
    "mom",
    "walk",
    "to",
    "the",
    "park",
    "The",
    "sky",
    "turns",
    "gray",
    "and",
    "a",
    "big",
    "dark",
    "cloud",
    "rolls",
    "in",
    "The",
    "wind",
    "starts",
    "to",
    "blow",
    "the",
    "leaves",
    "around",
    "Ben",
    "feels",
    "a",
    "cold",
    "drop",
    "land",
    "on",
    "his",
    "hand",
    "His",
    "mom",
    "opens",
    "her",
    "umbrella",
    "just",
    "in",
    "time",
    "Fat",
    "raindrops",
    "begin",
    "to",
    "fall",
    "all",
    "over",
    "the",
    "park",
    "Ben",
    "and",
    "his",
    "mom",
    "hurry",
    "home",
    "before",
    "the",
    "storm",
    "gets",
    "worse"
  ]
}
