{
  "id": "g2-vowel-teams-001",
  "grade": 2,
  "title": "The Boat Trip",
  "source": "original",
  "text": "Dean and his team paddled their boat down the stream. They saw a deer near the trees. Rain began to fall, so they wore their raincoats. Soon they reached the pier and tied up the boat. Dean and his team ate a snack of bread and cheese before heading home.",
  "words": [
    "Dean",
    "and",
    "his",
    "team",
    "paddled",
    "their",
    "boat",
    "down",
    "the",
    "stream",
    "They",
    "saw",
    "a",
    "deer",
    "near",
    "the",
    "trees",
    "Rain",
    "began",
    "to",
    "fall",
    "so",
    "they",
    "wore",
    "their",
    "raincoats",
    "Soon",
    "they",
    "reached",
    "the",
    "pier",
    "and",
    "tied",
    "up",
    "the",
    "boat",
    "Dean",
    "and",
    "his",
    "team",
    "ate",
    "a",
    "snack",
    "of",
    "bread",
    "and",
    "cheese",
    "before",
    "heading",
    "home"
  ],
  "skills": [
    "vowel_teams",
    "consonant_blends"
  ],
  "primary_skill": "vowel_teams",
  "comprehension_hint_topics": [
    "what the team saw near the trees",
    "why they wore raincoats"
  ]
}
