{
  "id": "g2-synonyms-antonyms-002",
  "grade": 2,
  "title": "Opposites in the Ocean",
  "source": "original",
  "text": "The ocean is home to creatures that are complete opposites of each other. A whale is enormous, while a seahorse is tiny by comparison. A dolphin swims swiftly through the water, but a starfish moves sluggishly along the sand. Some fish stay near the bright, sunny surface, while others live in the dark, gloomy depths. Scientists study every one of these creatures closely, from the fastest swimmers to the slowest, to understand how they all share the same ocean home.",
  "words": [
    "The",
    "ocean",
    "is",
    "home",
    "to",
    "creatures",
    "that",
    "are",
    "complete",
    "opposites",
    "of",
    "each",
    "other",
    "A",
    "whale",
    "is",
    "enormous",
    "while",
    "a",
    "seahorse",
    "is",
    "tiny",
    "by",
    "comparison",
    "A",
    "dolphin",
    "swims",
    "swiftly",
    "through",
    "the",
    "water",
    "but",
    "a",
    "starfish",
    "moves",
    "sluggishly",
    "along",
    "the",
    "sand",
    "Some",
    "fish",
    "stay",
    "near",
    "the",
    "bright",
    "sunny",
    "surface",
    "while",
    "others",
    "live",
    "in",
    "the",
    "dark",
    "gloomy",
    "depths",
    "Scientists",
    "study",
    "every",
    "one",
    "of",
    "these",
    "creatures",
    "closely",
    "from",
    "the",
    "fastest",
    "swimmers",
    "to",
    "the",
    "slowest",
    "to",
    "understand",
    "how",
    "they",
    "all",
    "share",
    "the",
    "same",
    "ocean",
    "home"
  ],
  "skills": [
    "synonyms_and_antonyms",
    "vowel_teams"
  ],
  "primary_skill": "synonyms_and_antonyms",
  "comprehension_hint_topics": [
    "which ocean words are opposites",
    "how a dolphin and a starfish move differently"
  ]
}
