{
  "id": "g2-authors-purpose-001",
  "grade": 2,
  "title": "How to Plant a Garden",
  "source": "original",
  "text": "If you want to grow your own vegetables, follow these simple steps. First, choose a sunny spot in your yard with good soil. Next, dig small holes and drop one seed into each hole. Then cover the seeds gently with dirt and water them well. Check your garden every day, and pull out any weeds you see. In a few weeks, tiny green sprouts will start to poke through the soil. With patience and care, your garden will soon be full of fresh vegetables.",
  "skills": [
    "authors_purpose",
    "main_idea_and_summarizing",
    "sequencing"
  ],
  "primary_skill": "authors_purpose",
  "comprehension_hint_topics": [
    "why the author wrote this passage",
    "what steps come first, next, and last"
  ],
  "words": [
    "If",
    "you",
    "want",
    "to",
    "grow",
    "your",
    "own",
    "vegetables",
    "follow",
    "these",
    "simple",
    "steps",
    "First",
    "choose",
    "a",
    "sunny",
    "spot",
    "in",
    "your",
    "yard",
    "with",
    "good",
    "soil",
    "Next",
    "dig",
    "small",
    "holes",
    "and",
    "drop",
    "one",
    "seed",
    "into",
    "each",
    "hole",
    "Then",
    "cover",
    "the",
    "seeds",
    "gently",
    "with",
    "dirt",
    "and",
    "water",
    "them",
    "well",
    "Check",
    "your",
    "garden",
    "every",
    "day",
    "and",
    "pull",
    "out",
    "any",
    "weeds",
    "you",
    "see",
    "In",
    "a",
    "few",
    "weeks",
    "tiny",
    "green",
    "sprouts",
    "will",
    "start",
    "to",
    "poke",
    "through",
    "the",
    "soil",
    "With",
    "patience",
    "and",
    "care",
    "your",
    "garden",
    "will",
    "soon",
    "be",
    "full",
    "of",
    "fresh",
    "vegetables"
  ]
}
