{
  "id": "g3-inferential-001",
  "grade": 3,
  "title": "The Fox and the Grapes",
  "source": "Adapted from Aesop's Fables (public domain)",
  "text": "A hungry fox spotted a bunch of plump, juicy grapes hanging from a high vine. He leaped again and again, stretching as far as he could, but the grapes stayed just out of reach. After many tries, his legs grew tired and his sides ached. Finally, the fox stepped back, sniffed at the vine, and muttered, \"Those grapes are probably sour anyway. I didn't want them.\" He turned and walked away, holding his head high as if nothing had happened.",
  "words": [
    "A",
    "hungry",
    "fox",
    "spotted",
    "a",
    "bunch",
    "of",
    "plump",
    "juicy",
    "grapes",
    "hanging",
    "from",
    "a",
    "high",
    "vine",
    "He",
    "leaped",
    "again",
    "and",
    "again",
    "stretching",
    "as",
    "far",
    "as",
    "he",
    "could",
    "but",
    "the",
    "grapes",
    "stayed",
    "just",
    "out",
    "of",
    "reach",
    "After",
    "many",
    "tries",
    "his",
    "legs",
    "grew",
    "tired",
    "and",
    "his",
    "sides",
    "ached",
    "Finally",
    "the",
    "fox",
    "stepped",
    "back",
    "sniffed",
    "at",
    "the",
    "vine",
    "and",
    "muttered",
    "Those",
    "grapes",
    "are",
    "probably",
    "sour",
    "anyway",
    "I",
    "didn't",
    "want",
    "them",
    "He",
    "turned",
    "and",
    "walked",
    "away",
    "holding",
    "his",
    "head",
    "high",
    "as",
    "if",
    "nothing",
    "had",
    "happened"
  ],
  "skills": [
    "inferential_comprehension",
    "literal_comprehension"
  ],
  "primary_skill": "inferential_comprehension",
  "comprehension_hint_topics": [
    "why the fox really said the grapes were sour",
    "how the fox actually felt about not reaching the grapes"
  ]
}
