{
  "id": "g1-compare-contrast-001",
  "grade": 1,
  "title": "Cats and Dogs",
  "source": "original",
  "text": "Cats and dogs are both popular pets, but they are quite different. Cats often nap in quiet, sunny spots for most of the day. Dogs love to run and play outside for hours. Cats clean themselves with their own tongue. Dogs need a bath from their owner instead. Both cats and dogs like to curl up next to their family at night.",
  "skills": [
    "compare_and_contrast",
    "literal_comprehension"
  ],
  "primary_skill": "compare_and_contrast",
  "comprehension_hint_topics": [
    "how cats and dogs are different",
    "how cats and dogs are alike"
  ],
  "words": [
    "Cats",
    "and",
    "dogs",
    "are",
    "both",
    "popular",
    "pets",
    "but",
    "they",
    "are",
    "quite",
    "different",
    "Cats",
    "often",
    "nap",
    "in",
    "quiet",
    "sunny",
    "spots",
    "for",
    "most",
    "of",
    "the",
    "day",
    "Dogs",
    "love",
    "to",
    "run",
    "and",
    "play",
    "outside",
    "for",
    "hours",
    "Cats",
    "clean",
    "themselves",
    "with",
    "their",
    "own",
    "tongue",
    "Dogs",
    "need",
    "a",
    "bath",
    "from",
    "their",
    "owner",
    "instead",
    "Both",
    "cats",
    "and",
    "dogs",
    "like",
    "to",
    "curl",
    "up",
    "next",
    "to",
    "their",
    "family",
    "at",
    "night"
  ]
}
