{
  "id": "g1-blends-001",
  "grade": 1,
  "title": "Brad and the Frog",
  "source": "original",
  "text": "Brad likes to play by the pond. He sees a green frog. The frog can jump fast. Brad claps his hands. The frog jumps into the pond with a splash. Brad grins and runs home to tell his mom.",
  "words": [
    "Brad",
    "likes",
    "to",
    "play",
    "by",
    "the",
    "pond",
    "He",
    "sees",
    "a",
    "green",
    "frog",
    "The",
    "frog",
    "can",
    "jump",
    "fast",
    "Brad",
    "claps",
    "his",
    "hands",
    "The",
    "frog",
    "jumps",
    "into",
    "the",
    "pond",
    "with",
    "a",
    "splash",
    "Brad",
    "grins",
    "and",
    "runs",
    "home",
    "to",
    "tell",
    "his",
    "mom"
  ],
  "skills": [
    "consonant_blends",
    "short_vowels"
  ],
  "primary_skill": "consonant_blends",
  "comprehension_hint_topics": [
    "what the frog did",
    "how Brad felt at the end"
  ]
}
