{
  "id": "g1-inflectional-001",
  "grade": 1,
  "title": "The Playful Pups",
  "source": "original",
  "text": "The pups are playing in the yard. One pup jumped over a box. Another pup barked at a bird. The pups chased their tails and rolled in the grass. Mom called the pups, and they ran to her quickly. The pups panted and rested by her feet.",
  "words": [
    "The",
    "pups",
    "are",
    "playing",
    "in",
    "the",
    "yard",
    "One",
    "pup",
    "jumped",
    "over",
    "a",
    "box",
    "Another",
    "pup",
    "barked",
    "at",
    "a",
    "bird",
    "The",
    "pups",
    "chased",
    "their",
    "tails",
    "and",
    "rolled",
    "in",
    "the",
    "grass",
    "Mom",
    "called",
    "the",
    "pups",
    "and",
    "they",
    "ran",
    "to",
    "her",
    "quickly",
    "The",
    "pups",
    "panted",
    "and",
    "rested",
    "by",
    "her",
    "feet"
  ],
  "skills": [
    "inflectional_endings",
    "consonant_blends"
  ],
  "primary_skill": "inflectional_endings",
  "comprehension_hint_topics": [
    "what the pups did in the yard",
    "what happened when Mom called"
  ]
}
