{
  "id": "g1-digraphs-001",
  "grade": 1,
  "title": "Chip the Chick",
  "source": "original",
  "text": "Chip is a little chick. Chip likes to peck and scratch. One day, Chip sees a fish in the pond. Chip does not know how to swim. Chip watches the fish from the bank. Then Chip chirps and runs back to the barn.",
  "words": [
    "Chip",
    "is",
    "a",
    "little",
    "chick",
    "Chip",
    "likes",
    "to",
    "peck",
    "and",
    "scratch",
    "One",
    "day",
    "Chip",
    "sees",
    "a",
    "fish",
    "in",
    "the",
    "pond",
    "Chip",
    "does",
    "not",
    "know",
    "how",
    "to",
    "swim",
    "Chip",
    "watches",
    "the",
    "fish",
    "from",
    "the",
    "bank",
    "Then",
    "Chip",
    "chirps",
    "and",
    "runs",
    "back",
    "to",
    "the",
    "barn"
  ],
  "skills": [
    "consonant_digraphs",
    "short_vowels"
  ],
  "primary_skill": "consonant_digraphs",
  "comprehension_hint_topics": [
    "why Chip does not go in the pond",
    "where Chip runs at the end"
  ]
}
