{
  "id": "g3-main-idea-001",
  "grade": 3,
  "title": "Why Bees Matter",
  "source": "original",
  "text": "Bees do much more than make honey. As they travel from flower to flower collecting nectar, they carry pollen that helps plants produce fruits, vegetables, and seeds. Without this pollination, many of the foods we eat every day, like apples, almonds, and strawberries, would become scarce and expensive. Unfortunately, bee populations have been shrinking due to disease, pesticides, and the loss of wildflowers. Scientists and farmers are now planting bee-friendly gardens and reducing harmful chemicals to help protect these important insects.",
  "words": [
    "Bees",
    "do",
    "much",
    "more",
    "than",
    "make",
    "honey",
    "As",
    "they",
    "travel",
    "from",
    "flower",
    "to",
    "flower",
    "collecting",
    "nectar",
    "they",
    "carry",
    "pollen",
    "that",
    "helps",
    "plants",
    "produce",
    "fruits",
    "vegetables",
    "and",
    "seeds",
    "Without",
    "this",
    "pollination",
    "many",
    "of",
    "the",
    "foods",
    "we",
    "eat",
    "every",
    "day",
    "like",
    "apples",
    "almonds",
    "and",
    "strawberries",
    "would",
    "become",
    "scarce",
    "and",
    "expensive",
    "Unfortunately",
    "bee",
    "populations",
    "have",
    "been",
    "shrinking",
    "due",
    "to",
    "disease",
    "pesticides",
    "and",
    "the",
    "loss",
    "of",
    "wildflowers",
    "Scientists",
    "and",
    "farmers",
    "are",
    "now",
    "planting",
    "bee",
    "friendly",
    "gardens",
    "and",
    "reducing",
    "harmful",
    "chemicals",
    "to",
    "help",
    "protect",
    "these",
    "important",
    "insects"
  ],
  "skills": [
    "main_idea_and_summarizing",
    "vocabulary_in_context"
  ],
  "primary_skill": "main_idea_and_summarizing",
  "comprehension_hint_topics": [
    "what this passage is mostly about",
    "why bee populations are shrinking",
    "how people are trying to help bees"
  ]
}
