{
  "id": "g3-prefixes-suffixes-002",
  "grade": 3,
  "title": "The Fearless Explorer",
  "source": "original",
  "text": "Captain Elena Reyes was known across every port as a fearless explorer, the kind of sailor who sailed straight into hurricanes while everyone else turned back toward shore. Her hands never shook and her voice never wavered, no matter how hard the storm howled outside the ship. When lightning cracked across the sky and the engine sputtered, coughed, and finally died, her crew feared it was unusable for good and that they would drift until help arrived. Elena refused to give up. She climbed below deck, pulled the ruined engine apart piece by piece, and spent the whole night patiently rebuilding it using only the tools bolted to the wall. By sunrise, the engine roared back to life exactly as it had before the storm, running just as smoothly as it always had, and the ship reached the shore safely.",
  "skills": [
    "prefixes_and_suffixes_meaning",
    "multisyllabic_decoding"
  ],
  "primary_skill": "prefixes_and_suffixes_meaning",
  "comprehension_hint_topics": [
    "how Elena reacted when the storm was at its worst",
    "what Elena did to the engine after it died"
  ],
  "words": [
    "Captain",
    "Elena",
    "Reyes",
    "was",
    "known",
    "across",
    "every",
    "port",
    "as",
    "a",
    "fearless",
    "explorer",
    "the",
    "kind",
    "of",
    "sailor",
    "who",
    "sailed",
    "straight",
    "into",
    "hurricanes",
    "while",
    "everyone",
    "else",
    "turned",
    "back",
    "toward",
    "shore",
    "Her",
    "hands",
    "never",
    "shook",
    "and",
    "her",
    "voice",
    "never",
    "wavered",
    "no",
    "matter",
    "how",
    "hard",
    "the",
    "storm",
    "howled",
    "outside",
    "the",
    "ship",
    "When",
    "lightning",
    "cracked",
    "across",
    "the",
    "sky",
    "and",
    "the",
    "engine",
    "sputtered",
    "coughed",
    "and",
    "finally",
    "died",
    "her",
    "crew",
    "feared",
    "it",
    "was",
    "unusable",
    "for",
    "good",
    "and",
    "that",
    "they",
    "would",
    "drift",
    "until",
    "help",
    "arrived",
    "Elena",
    "refused",
    "to",
    "give",
    "up",
    "She",
    "climbed",
    "below",
    "deck",
    "pulled",
    "the",
    "ruined",
    "engine",
    "apart",
    "piece",
    "by",
    "piece",
    "and",
    "spent",
    "the",
    "whole",
    "night",
    "patiently",
    "rebuilding",
    "it",
    "using",
    "only",
    "the",
    "tools",
    "bolted",
    "to",
    "the",
    "wall",
    "By",
    "sunrise",
    "the",
    "engine",
    "roared",
    "back",
    "to",
    "life",
    "exactly",
    "as",
    "it",
    "had",
    "before",
    "the",
    "storm",
    "running",
    "just",
    "as",
    "smoothly",
    "as",
    "it",
    "always",
    "had",
    "and",
    "the",
    "ship",
    "reached",
    "the",
    "shore",
    "safely"
  ]
}
