{
  "id": "g1-closed-syllables-001",
  "grade": 1,
  "title": "Bob's Big Job",
  "source": "original",
  "text": "Bob has a big job. Bob must fix the fence. Bob gets his hammer and nails. Bob taps and taps. The fence is fixed. Bob sits on the step and rests. Bob is glad the job is done.",
  "words": [
    "Bob",
    "has",
    "a",
    "big",
    "job",
    "Bob",
    "must",
    "fix",
    "the",
    "fence",
    "Bob",
    "gets",
    "his",
    "hammer",
    "and",
    "nails",
    "Bob",
    "taps",
    "and",
    "taps",
    "The",
    "fence",
    "is",
    "fixed",
    "Bob",
    "sits",
    "on",
    "the",
    "step",
    "and",
    "rests",
    "Bob",
    "is",
    "glad",
    "the",
    "job",
    "is",
    "done"
  ],
  "skills": [
    "closed_syllables",
    "short_vowels"
  ],
  "primary_skill": "closed_syllables",
  "comprehension_hint_topics": [
    "what job Bob had to do",
    "how Bob felt when he was done"
  ]
}
