{
  "id": "g1-character-traits-001",
  "grade": 1,
  "title": "Sam Shares His Snack",
  "source": "original",
  "text": "At lunch, Sam sees that Lily forgot her snack. Lily's stomach growls, and she looks sad. Sam breaks his crackers in half without being asked. He hands half to Lily with a big smile. Lily says thank you, and the two friends eat together. Sam always looks for ways to help his classmates.",
  "skills": [
    "character_traits_and_analysis",
    "literal_comprehension",
    "consonant_blends"
  ],
  "primary_skill": "character_traits_and_analysis",
  "comprehension_hint_topics": [
    "what Sam's actions show about him",
    "how Lily feels before Sam helps her"
  ],
  "words": [
    "At",
    "lunch",
    "Sam",
    "sees",
    "that",
    "Lily",
    "forgot",
    "her",
    "snack",
    "Lily's",
    "stomach",
    "growls",
    "and",
    "she",
    "looks",
    "sad",
    "Sam",
    "breaks",
    "his",
    "crackers",
    "in",
    "half",
    "without",
    "being",
    "asked",
    "He",
    "hands",
    "half",
    "to",
    "Lily",
    "with",
    "a",
    "big",
    "smile",
    "Lily",
    "says",
    "thank",
    "you",
    "and",
    "the",
    "two",
    "friends",
    "eat",
    "together",
    "Sam",
    "always",
    "looks",
    "for",
    "ways",
    "to",
    "help",
    "his",
    "classmates"
  ]
}
